{
    "connections": [
        {
            "to": "addition1.a",
            "from": "integers1.a",
            "channel": "integers1"
        },
        {
            "to": "addition1.b",
            "from": "integers1.b",
            "channel": "integers1"
        },
        {
            "to": "addition2.a",
            "from": "integers2.a",
            "channel": "integers2"
        },
        {
            "to": "addition2.b",
            "from": "integers2.b",
            "channel": "integers2"
        },
        {
            "to": "addition3.a",
            "from": "addition1.sum",
            "channel": "integers1"
        },
        {
            "to": "addition3.b",
            "from": "addition2.sum",
            "channel": "integers2"
        },
        {
            "to": "analysis.input",
            "from": "addition3.sum",
            "channel": "integers1"
        }
    ],
    "datasets": [
        {
            "outputs": [
                "a",
                "b"
            ],
            "name": "integers1"
        },
        {
            "outputs": [
                "a",
                "b"
            ],
            "name": "integers2"
        }
    ],
    "blocks": [
        {
            "inputs": [
                "a",
                "b"
            ],
            "synchronized_channel": "integers1",
            "name": "addition1",
            "outputs": [
                "sum"
            ]
        },
        {
            "inputs": [
                "a",
                "b"
            ],
            "synchronized_channel": "integers2",
            "name": "addition2",
            "outputs": [
                "sum"
            ]
        },
        {
            "inputs": [
                "a",
                "b"
            ],
            "synchronized_channel": "integers1",
            "name": "addition3",
            "outputs": [
                "sum"
            ]
        }
    ],
    "analyzers": [
        {
            "inputs": [
                "input"
            ],
            "synchronized_channel": "integers1",
            "name": "analysis"
        }
    ],
    "representation": {
      "connections": {
      },
      "blocks": {
      },
      "channel_colors": {
        "integers1": "#5555ff",
        "integers2": "#ff5555"
      }
    }
}
