{
    "connections": [
        {
            "from": "integers.a",
            "to": "addition.a",
            "channel": "integers"
        },
        {
            "from": "integers.b",
            "to": "addition.b",
            "channel": "integers"
        },
        {
            "from": "addition.sum",
            "to": "analysis.input",
            "channel": "integers"
        }
    ],
    "datasets": [
        {
            "outputs": [
                "a",
                "b"
            ],
            "name": "integers"
        }
    ],
    "blocks": [
        {
            "inputs": [
                "a",
                "b"
            ],
            "synchronized_channel": "integers",
            "name": "addition",
            "outputs": [
                "sum"
            ]
        }
    ],
    "analyzers": [
        {
            "inputs": [
                "input"
            ],
            "synchronized_channel": "integers",
            "name": "analysis"
        }
    ],
    "representation": {
      "connections": {
      },
      "blocks": {
      },
      "channel_colors": {
        "integers": "#5555ff"
      }
    }
}
