{
    "schema_version": 2,
    "connections": [
        {
            "from": "integers.a",
            "to": "loop_super_block.in",
            "channel": "integers"
        },
        {
            "from": "integers2.out",
            "to": "loop_super_block.in_loop",
            "channel": "integers"
        },
        {
            "from": "loop_super_block.out",
            "to": "analysis.input",
            "channel": "integers"
        },
        {
            "from": "loop_super_block.out_loop",
            "to": "loop_analysis.input",
            "channel": "integers"
        }
    ],
    "datasets": [
        {
            "outputs": [
                "a",
                "b"
            ],
            "name": "integers"
        },
        {
            "outputs": [
                "out"
            ],
            "name": "integers2"
        }
    ],
    "loops": [
        {
            "name": "loop_super_block",
            "synchronized_channel": "integers",
            "processor_inputs": [
                "in"
            ],
            "processor_outputs": [
                "out"
            ],
            "evaluator_inputs": [
                "in_loop"
            ],
            "evaluator_outputs": [
                "out_loop"
            ]
        }
    ],
    "blocks": [
    ],
    "analyzers": [
        {
            "inputs": [
                "input"
            ],
            "synchronized_channel": "integers",
            "name": "analysis"
        },
        {
            "inputs": [
                "input"
            ],
            "synchronized_channel": "integers",
            "name": "loop_analysis"
        }
    ],
    "representation": {
      "connections": {
      },
      "blocks": {
      },
      "channel_colors": {
        "integers": "#5555ff"
      }
    }
}
